{
  "schema": "status_packet_v1",
  "component": "governance",
  "canonical_status": "functional_acceptance_pending",
  "evidence_links": [
    "/workspace/mediastreamer/journals/system-integration-normalization/STATUS_system_integration_normalization_v8.md"
  ],
  "blockers": [
    "unsupported components still cannot use autonomous delivery and must still escalate or no-op safely"
  ],
  "recommended_owner_action": "changes-requested",
  "next_owner_click": "request_changes",
  "decision_scoring": {
    "evidence_quality": 2,
    "rollback_readiness": 2,
    "blast_radius": "medium",
    "confidence": 68
  },
  "rollback_action": {
    "enabled": true,
    "command": "git revert <merge_commit_for_governance>",
    "verification": [
      "rerun governance/report checks",
      "confirm owner action contract fields still render"
    ]
  },
  "timestamp": "2026-04-16T00:00:00+00:00",
  "source_commit": "44307cda45834d82763007c121982c4d2e7c78a4"
}
