{
  "schema": "status_packet_v1",
  "component": "tuner",
  "canonical_status": "functional_acceptance_pending",
  "evidence_links": [
    "/workspace/mediastreamer/journals/scale-radio-tuner/current_state_v2.md",
    "/workspace/mediastreamer/journals/scale-radio-tuner/stream_v2.md"
  ],
  "blockers": [
    "the currently normalized deploy lane intentionally covers the overlay and resident renderer service only",
    "`radio_scale_source` remains out of deploy-lane scope until full integration and is currently governed by hardware controls (encoder short/long press)",
    "first-show pointer sweep after boot remains unresolved",
    "exit white flashes remain unresolved"
  ],
  "recommended_owner_action": "changes-requested",
  "next_owner_click": "request_changes",
  "decision_scoring": {
    "evidence_quality": 2,
    "rollback_readiness": 2,
    "blast_radius": "medium",
    "confidence": 68
  },
  "rollback_action": {
    "enabled": true,
    "command": "git revert <merge_commit_for_tuner>",
    "verification": [
      "rerun governance/report checks",
      "confirm owner action contract fields still render"
    ]
  },
  "timestamp": "2026-04-16T00:00:00+00:00",
  "source_commit": "44307cda45834d82763007c121982c4d2e7c78a4"
}
