{
  "schema": "status_packet_v1",
  "component": "ui",
  "canonical_status": "deploy_candidate_started",
  "evidence_links": [
    "/workspace/mediastreamer/journals/system-integration-normalization/ui_gui_stream_v1.md"
  ],
  "blockers": [],
  "recommended_owner_action": "accept",
  "next_owner_click": "approve_pr",
  "decision_scoring": {
    "evidence_quality": 3,
    "rollback_readiness": 3,
    "blast_radius": "low",
    "confidence": 85
  },
  "rollback_action": {
    "enabled": true,
    "command": "git revert <merge_commit_for_ui>",
    "verification": [
      "rerun governance/report checks",
      "confirm owner action contract fields still render"
    ]
  },
  "timestamp": "2026-04-16T00:00:00+00:00",
  "source_commit": "44307cda45834d82763007c121982c4d2e7c78a4"
}
